ECCO.MI,LU2099991536,UBS LFS Bloom MSCI Glbl Liq Corp Sust USD Aac,Bond Global Corporates USD,Bond ETF,Luxembourg,2020-06-26,2023-11-09,3.370294318959617,58.74857839155158,0.6297729400642423
ECOEUA.MI,LU0721553864,UBS LFS Bloomberg EuroAreaLiqCrpUCITS ETF(EUR)Adis,Bond EUR Corporates,Bond ETF,Luxembourg,2013-01-23,2023-11-07,10.787132101300479,162.32303299492386,8.660559220178044
TIP10E.MI,LU1459803059,UBS LFS Bloomberg TIPS 10+ ETF A EUR Hg C,Bond USD Inflation Linked,Bond ETF,Luxembourg,2020-04-15,2023-09-26,3.4469541409993156,92.25536139793486,1.1186121629338712
TIP10D.MI,LU1459802754,UBS LFS Bloomberg TIPS 10+ UCI ETF(USD)Ad,Bond USD Inflation Linked,Bond ETF,Luxembourg,2016-11-10,2023-11-07,6.9897330595482545,144.35458284371327,0.7961314703903848
TIP1D.MI,LU1459801434,UBS LFS Bloomberg TIPS 1-10 UCI ETF(USD)Ad,Bond USD Inflation Linked,Bond ETF,Luxembourg,2016-11-10,2023-11-10,6.997946611909651,192.62793427230048,0.7328010875644977
TIP1E.MI,LU1459801780,UBS LFS Bloomberg TIPS 1-10UCI ETF(EURh)Aa,Bond USD Inflation Linked,Bond ETF,Luxembourg,2016-12-13,2023-11-10,6.907597535934292,254.2128418549346,7.057993669455072
GEBE.MI,LU2194286006,UBS LFS JPM EMU Gov ESG Liq Bond UCITS ETF EUR Ac,Bond EMU Government,Bond ETF,Luxembourg,2020-09-09,2023-11-10,3.167693360711841,149.00432152117546,4.026478957020469
EGO.MI,LU1974693662,UBS LFS JPM GBL GOV ESG LD BD A USD ACC,Bond USD Government,Bond ETF,Luxembourg,2019-10-15,2023-11-10,4.071184120465435,166.78194351042367,0.4398900668695096
EGE.MI,LU1974694553,UBS LFS JPM Gbl Gov ESG Liq Bd ETF hdg EUR A-ac,Bond USD Government,Bond ETF,Luxembourg,2020-04-20,2023-09-28,3.4387405886379194,218.1031050955414,2.4555510864483945
CANA.MI,LU0950672807,UBS LFS MSCI Canada UCITS ETF (CAD) A-acc,Equity Canada,Equity ETF,Luxembourg,2019-01-29,2023-11-10,4.780287474332649,232.20360824742266,1.8107869093625961
CANEUA.MI,LU0446734872,UBS LFS MSCI Canada UCITS ETF (CAD) Adis,,Equity ETF,Luxembourg,2010-06-07,2023-11-10,13.426420260095824,252.56173531810768,4.651838892956257
CINESG.MI,LU1953188833,UBS LFS MSCI China ESG Universal Low Carbon Sel Ad,Equity China,Equity ETF,Luxembourg,2019-08-22,2023-11-10,4.219028062970568,231.3329007138222,1.545787342652733
EMMUSC.MI,LU0950674175,UBS LFS MSCI Emerging Markets UCITS ETF (USD) Aa,Equity Emerging Mkts Global,Equity ETF,Luxembourg,2019-01-11,2023-11-10,4.829568788501026,238.73767006802723,6.039517708378909
EMMEUA.MI,LU0480132876,UBS LFS MSCI Emerging Markets UCITS ETF (USD)Ad,,Equity ETF,Luxembourg,2013-02-12,2023-11-10,10.740588637919233,246.35521284731075,18.51893226874212
EMVEUA.MI,LU0446734369,UBS LFS MSCI EMU Value UCITS ETF (EUR) Adis,,Equity ETF,Luxembourg,2010-07-28,2023-11-10,13.286789869952088,209.38089841335255,5.605849622223471
EUREUA.MI,LU0446734104,UBS LFS MSCI Europe UCITS ETF (EUR) Adis,Equity Europe,Equity ETF,Luxembourg,2010-07-26,2023-11-09,13.289527720739219,189.02101359703337,10.400236254105879
JPNA.MI,LU0950671825,UBS LFS MSCI Japan UCITS ETF (JPY) A-acc,Equity Japan,Equity ETF,Luxembourg,2019-03-04,2023-11-09,4.684462696783025,204.93278784336647,6.392026489216626
PACEUA.MI,LU0446734526,UBS LFS MSCI Pacific (ex Japan) UCITS ETF(USD)Ad,Equity Asia Pacific ex Japan,Equity ETF,Luxembourg,2010-06-29,2023-10-20,13.308692676249144,207.30811561407117,5.095089238607576
SIVE.MI,LU1169830103,UBS LFS MSCI Switzerland 20/35 UCITS ETF hEUR Aacc,Equity Switzerland,Equity ETF,Luxembourg,2020-09-22,2023-11-10,3.132101300479124,204.97421328671328,1.1814015100882989
USAEUA.MI,LU0136234654,UBS LFS MSCI USA UCITS ETF (USD) Adis,Equity US,Equity ETF,Luxembourg,2010-06-08,2023-10-17,13.357973990417522,186.48037507686,87.08257374515625
WRDEUA.MI,LU0340285161,UBS LFS MSCI World UCITS ETF (USD) Adis,Equity Global,Equity ETF,Luxembourg,2010-10-04,2023-11-10,13.100616016427105,233.882131661442,24.562105431212487
SF1EUA.MI,LU0879397742,UBS LFS SBI® Foreign AAA-BBB 1-5 ESG UCITS CHF Ad,Bond CHF,Bond ETF,Luxembourg,2013-09-16,2023-11-09,10.146475017111568,201.84349703184026,0.38352707672451153
SF5EUA.MI,LU0879399441,UBS LFS SBI® Foreign AAA-BBB 5-10 ESG UCITS CHF Ad,Bond CHF,Bond ETF,Luxembourg,2013-09-18,2023-11-10,10.143737166324435,172.91457489878545,0.5509926916768417
U15S.MI,LU2408467723,UBS LFS-Bl MSCI US LqCorp 1-5YSust UCITS ETF USD A,Bond USD Corporates,Bond ETF,Luxembourg,2022-04-19,2023-11-06,1.5496235455167693,111.64001766784453,1.3490941803396301
U15E.MI,LU2408468291,UBS LFS-Bl MSCI US LqCorp1-5YSust UCITS ETF hEUR A,Bond USD Corporates,Bond ETF,Luxembourg,2022-04-20,2023-11-10,1.5578370978781657,225.9543057996485,0.5493212180481135
UST10F.MI,LU1459800113,UBS LFS-Blmbrg Brcls US10+ Yr TrBd UCIETF(EURh)Ad,Bond USD Government,Bond ETF,Luxembourg,2016-11-10,2023-11-10,6.997946611909651,227.781103286385,1.1215969578176752
INFL10.MI,LU1645381689,UBS LFS-Blmbrg Eur InflLnk10+ UCIT ETF(EUR)Ad,Bond EUR Inflation Linked,Bond ETF,Luxembourg,2017-12-01,2023-11-08,5.935660506502396,144.71851937269372,1.065452244306086
INFL1.MI,LU1645380368,UBS LFS-Blmbrg Eur InflLnk1-10 UCI ETF(EUR)Ad,Bond EUR Inflation Linked,Bond ETF,Luxembourg,2017-11-29,2023-11-10,5.946611909650924,230.88777624309392,3.2957631712803437
CBSEU.MI,LU1484799769,UBS LFSBlmbrg MSCIEurAr LCrpSu UCI ETF(EUR)Ad,Bond EUR Corporates,Bond ETF,Luxembourg,2017-02-17,2023-11-10,6.7268993839835725,210.3495115995116,5.659213645201175
CBUS5.MI,LU1048314949,UBS LFSBlmbrg US LiqCorp1-5 Yr ETF(USD)Ad,Bond USD Corporates,Bond ETF,Luxembourg,2015-01-14,2023-11-10,8.821355236139631,232.95740223463685,2.09553115318852
CBUS5E.MI,LU1048315243,UBS LFSBlmbrg US LiqCorp1-5Yr UCI ETF(EURh)Aa,,Bond ETF,Luxembourg,2015-04-28,2023-11-10,8.536618754277892,254.78471776779986,11.824712434517817
SS1EUA.MI,LU0969639128,UBS LFSBloomberg BrclsEUR Trsry1-10 UCI ETF(EUR)Ad,Bond EUR,Bond ETF,Luxembourg,2014-01-14,2023-11-10,9.820670773442847,253.54683579592975,7.976817514511179
CBUS.MI,LU1048316647,UBS LFS-Bloomberg US Liq Corp UCI ETF(USD)Ad,Bond USD Corporates,Bond ETF,Luxembourg,2015-01-14,2023-11-10,8.821355236139631,174.3496275605214,1.3732714157423016
CBUSE.MI,LU1048317025,UBS LFS-Bloomberg US LiqCorp UCI ETF(EURh)Aa,*DON'T USE Bond Other EUR Hedged,Bond ETF,Luxembourg,2014-06-20,2023-11-10,9.390828199863108,254.18418367346936,8.28367986533581
UST1F.MI,LU1324510525,UBS LFSBloomberg US1-3Yr TrsBd UCIETF(EURh)Ad,Bond USD Government Short Term,Bond ETF,Luxembourg,2016-02-18,2023-09-28,7.60848733744011,208.3199892047499,1.8349854930003486
SBEME.MI,LU1324516308,UBS LFS-Bloomberg USD EM Sov UCI ETF(EURh)Aa,*Bond Emerging Markets Global HC,Bond ETF,Luxembourg,2016-05-13,2023-09-28,7.3757700205338805,254.61748329621383,3.819207514571285
SBEM.MI,LU1324516050,UBS LFS-Bloomberg USD EM Sov UCI ETF(USD)Ad,*Bond Emerging Markets Global HC,Bond ETF,Luxembourg,2016-02-16,2023-11-10,7.731690622861054,231.644033286119,1.426833408573896
CBEU5.MI,LU1048314196,UBS LFSBloombergEA LiqCorp1-5YrUCI ETF(EUR)Ad,Bond EUR Corporates,Bond ETF,Luxembourg,2014-07-03,2023-11-10,9.35523613963039,253.86852502194907,4.368136170337082
CBSUS.MI,LU1215461085,UBS LFSBloombergMSCIUS LCrpSustUCI ETF(USD)Ad,Bond USD Corporates,Bond ETF,Luxembourg,2015-09-01,2023-09-28,8.073921971252567,172.77848423194303,1.4038056085787993
CBSUSE.MI,LU1215461325,UBS LFSBloombergMSCIUS LCSustUCI ETF(EURh)Aa,Bond USD Corporates,Bond ETF,Luxembourg,2016-09-15,2023-11-09,7.148528405201916,172.2032746074301,1.4280024570570515
EPVLD.MI,LU1215452928,UBS LFS-Factor MSCI EMU Prime Value ESG U (EUR) Ad,Equity EuroZone,Equity ETF,Luxembourg,2015-10-05,2023-11-09,8.095824777549623,142.4190902942171,0.9447228733621256
EQLTD.MI,LU1215451524,UBS LFS-Factor MSCI EMU Quality ESG UCITS (EUR) Ad,Equity EuroZone,Equity ETF,Luxembourg,2015-10-05,2023-11-10,8.098562628336756,189.53980730223122,1.1438151526142741
JPSRE.MI,LU1273488715,UBS LFS-MSCI Japan Soc Responsible U ETF (EURh) Ac,Equity Japan,Equity ETF,Luxembourg,2016-09-14,2023-09-28,7.036276522929501,186.17801556420233,0.8090737184538291
SW2CHB.MI,LU0977261329,UBS LFS-MSCI Switzerland 20/35 UCITS ETF (CHF) A-a,Equity Switzerland,Equity ETF,Luxembourg,2013-12-09,2023-11-10,9.919233401779604,254.1527049406569,9.08332654653034
UKGBPB.MI,LU0950670850,UBS LFS-MSCI United Kingdom UCITS ETF (GBP) A-acc,Equity UK,Equity ETF,Luxembourg,2019-01-11,2023-11-08,4.824093086926762,182.8322928490352,10.772643741419882
CBSUSA.MI,LU1215461168,UBS LFS-MSCI US Liq CorpSust U ETF(USD)Aa,Bond USD Corporates,Equity ETF,Luxembourg,2019-09-30,2023-09-28,3.994524298425736,91.37508567511995,1.0751463072892165
ASREUA.MI,LU0629460089,UBS LFS-MSCI USA Socially Responsible (USD)Ad,Equity US,Equity ETF,Luxembourg,2013-03-15,2023-11-10,10.655715263518138,235.7420349434738,49.001784845703384
USSRF.MI,LU1280303014,UBS LFS-MSCI USA Socially Responsible U (htoEUR)Ad,Equity US,Equity ETF,Luxembourg,2016-10-19,2023-11-10,7.058179329226557,169.16543832428238,0.8298695429420849
SPDA.MI,IE000JQ2IJD3,UBS S&P USA Dividend ESG ETF,,Equity ETF,,2023-07-06,2023-11-08,0.34223134839151265,26.298000000000002,0.02106479686027778
EMUESG.MI,IE00BNC0M913,UBS(Irl)ETF plc MSCI EMU ESG UnvLowCarbSelUEEURAa,Equity EuroZone,Equity ETF,Ireland,2021-09-30,2023-10-19,2.0506502395619437,30.234312416555408,0.42083595029625814
EURESG.MI,IE00BNC0M681,UBS(Irl)ETF plc MSCI Euro ESG UnvLowCarbSelUEEURAa,Equity Europe,Equity ETF,Ireland,2022-02-24,2023-10-25,1.6646132785763177,24.63034539473684,0.39826041727092687
JPESG.MI,IE00BNC0MD55,UBS(Irl)ETF plc MSCI Jpn ESG UnvLowCarbSelUEJPYAa,Equity Japan,Equity ETF,Ireland,2023-01-19,2023-01-27,0.02190280629705681,91.3125,0.006450939520000001
USESGA.MI,IE00BNC0M350,UBS(Irl)ETF plc MSCI USA ESG UnvLowCarbSelUEUSDAa,Equity US,Equity ETF,Ireland,,,,,
UQLTE.MI,IE00BWT3KN65,UBS(Irl)ETFplc Factor MSCI USA Qlt ESG UE HEUR Aa,Equity US,Equity ETF,Ireland,2016-04-26,2023-11-10,7.540041067761807,144.16367102396512,0.9389129171338231
UQLTD.MI,IE00BX7RRJ27,UBS(Irl)ETFplc Factor MSCI USA Qlt ESG UETF USD Ad,Equity US,Equity ETF,Ireland,2015-10-05,2023-11-10,8.098562628336756,223.86688640973628,3.9749000255994527
ULOVE.MI,IE00BWT3KJ20,UBS(Irl)ETFplc Fctr MSCI USA Low Vltlt UE HEUR Aa,Equity US,Equity ETF,Ireland,2016-02-10,2023-10-13,7.671457905544147,137.91381156316916,0.9438716661595405
ULOVD.MI,IE00BX7RQY03,UBS(Irl)ETFplc Fctr MSCI USA Low Vltlt UE USD Ad,Equity US,Equity ETF,Ireland,2015-10-23,2023-10-11,7.967145790554415,84.09536082474226,0.5837523526730928
UPVLD.MI,IE00BX7RR706,UBS(Irl)ETFplc Fctr MSCI USA PrVal ESG UETF USD Ad,Equity US,Equity ETF,Ireland,2015-10-05,2023-11-09,8.095824777549623,142.4190902942171,2.651352934577257
ACPAR.MI,IE00BN4Q0P93,UBS(Irl)ETFplc MSCI ACWI ClimParAl UCITS ETF USDAa,Equity Global,Equity ETF,Ireland,2021-09-07,2023-08-04,1.9055441478439425,13.119612068965518,0.39534750043392003
AWESG.MI,IE00BDQZMX67,UBS(Irl)ETFplc MSCI ACWI ESG Unv LCar Sel UE USDAd,Equity Global,Equity ETF,Ireland,2021-08-23,2023-11-10,2.21492128678987,240.18912237330036,0.9522849388753223
AWSRIE.MI,IE00BDR55927,UBS(Irl)ETFplc MSCI ACWI Soc Rsp UCITS ETF HEUR Aa,Equity Global,Equity ETF,Ireland,2018-01-15,2023-11-10,5.817932922655715,226.19717647058823,4.90269043147036
EMPAB.MI,IE00BN4Q1675,UBS(Irl)ETFplc MSCI EM ClimParAl UCITS ETF USD Aa,Equity Emerging Mkts Global,Equity ETF,Ireland,2021-08-10,2023-05-15,1.7604380561259412,7.952566096423017,0.13624203379885716
EMUPA.MI,IE00BN4Q0L55,UBS(Irl)ETFplc MSCI EMU ClimParAl UCITS ETF EURAA,Equity EuroZone,Equity ETF,Ireland,2021-04-28,2023-09-18,2.3901437371663246,16.735395189003434,0.2991137978426999
EURPA.MI,IE00BN4Q0933,UBS(Irl)ETFplc MSCI EuropeClimParAlUCITS ETF EURAA,Equity Europe,Equity ETF,Ireland,2021-04-28,2023-07-20,2.2258726899383983,28.30350553505535,0.0929748975450159
JPA.MI,IE00BN4Q0X77,UBS(Irl)ETFplc MSCI JapanClimParAl UCITS ETF JPYAA,Equity Japan,Equity ETF,Ireland,2021-05-11,2023-09-11,2.3353867214236823,29.11723329425557,0.1439744929183529
JPEUB.MI,IE000JHYO4T6,UBS(Irl)ETFplc MSCI JpnClimParAl U ETF ir HEURAA,Equity Japan,Equity ETF,Ireland,,,,,
PEXE.MI,IE000BAF6X29,UBS(Irl)ETFplc MSCI PaceJpn IMI SllRsp UETF HEURAa,Equity Asia Pacific ex Japan,Equity ETF,Ireland,2023-01-17,2023-06-30,0.4490075290896646,4.454268292682927,0.010084692356
PEX.MI,IE000BKMMHF9,UBS(Irl)ETFplc MSCI PaceJpn IMI SllRsp UETF USD Aa,Equity Asia Pacific ex Japan,Equity ETF,Ireland,2022-09-02,2023-10-24,1.1416837782340863,8.758992805755396,0.8501587546139999
USAPA.MI,IE00BN4Q0602,UBS(Irl)ETFplc MSCI USA ClimParAl UCITS ETF USDAA,Equity US,Equity ETF,Ireland,2021-04-29,2023-08-22,2.3134839151266258,15.560946745562129,0.11915441648422222
USSRIE.MI,IE00BJXT3G33,UBS(Irl)ETFplc MSCI USA Soc Rsp UCITS ETF HEUR Aa,Equity US,Equity ETF,Ireland,2020-06-30,2023-09-26,3.238877481177276,200.99556213017752,0.8988674714255055
USSRI.MI,IE00BJXT3C94,UBS(Irl)ETFplc MSCI USA Soc Rsp UCITS ETF USD Aa,Equity US,Equity ETF,Ireland,2020-10-02,2023-11-10,3.1047227926078027,29.632275132275133,2.0645229130386085
WSRIE.MI,IE00BK72HM96,UBS(Irl)ETFplc MSCI Wld Soc Rsp UCITS ETF HEUR Aa,Equity Global,Equity ETF,Ireland,2020-06-25,2023-11-10,3.375770020533881,112.86313868613138,1.557002068266559
WSRIA.MI,IE00BK72HJ67,UBS(Irl)ETFplc MSCI World Soc Rsp UCITS ETF USD Aa,Equity Global,Equity ETF,Ireland,2020-07-14,2023-11-02,3.3018480492813143,89.34390547263682,1.1998210516851038
WOPA.MI,IE00BN4Q0370,UBS(Irl)ETFplc MSCI WorldClimParAl UCITS ETF USDAA,Equity Global,Equity ETF,Ireland,2021-04-27,2023-09-11,2.3737166324435317,20.22145328719723,0.09718166468574999
SPDE.MI,IE000S6476U8,UBS(Irl)ETFplc S&P US Div ArstESG Elt UETF HEUR Ad,,Equity ETF,,2023-08-01,2023-10-27,0.23819301848049282,50.37931034482759,0.025313860693750006
CLIMA.MI,IE00BN4PXC48,UBS(Irl)ETFplc UBS ClimAwareGlbDevEqCTBU ETF USDAa,Equity Global,Equity ETF,Ireland,2021-04-01,2023-03-23,1.9739904175222451,8.105409153952843,0.188237700191
CCEUAS.MI,IE00B58HMN42,UBS(Irl)FdSltnsplc CMCI Comp SF UCITS ETF HEUR Aa,,Commodity ETF,Ireland,2013-05-28,2023-11-10,10.453114305270363,254.37395233106338,17.377382720610225
CCUSAS.MI,IE00B53H0131,UBS(Irl)FdSltnsplc CMCI Comp SF UCITS ETF USD Aa,Commodity Blended,Commodity ETF,Ireland,2015-04-14,2023-11-10,8.574948665297741,241.05100574712642,9.926996657353408
AJEUAS.MI,IE00B7WK2W23,UBS(Irl)FdSltnsplc MSCI AC As ex Jp SF U ETF USDAa,Equity Asia Pacific ex Japan,Equity ETF,Ireland,2013-05-24,2023-11-10,10.464065708418891,221.04218995290424,8.595282313465795
ACWIE.MI,IE00BYM11K57,UBS(Irl)FdSltnsplc MSCI ACWI SF UCITS ETF HEUR Aa,Equity Global,Equity ETF,Ireland,2017-02-27,2023-11-10,6.699520876112252,254.3465467919902,240.8733316905245
ACWIA.MI,IE00BYM11H29,UBS(Irl)FdSltnsplc MSCI ACWI SF UCITS ETF USD Aacc,Equity Global,Equity ETF,Ireland,2018-11-14,2023-11-10,4.988364134154689,194.8534577387486,39.90480623326354
CHINA.MI,IE00BKFB6K94,UBS(Irl)FdSltnsplc MSCI China A SF U ETF USD Acc,Equity China,Equity ETF,Ireland,2021-03-08,2023-11-10,2.674880219028063,218.32753326509723,16.656672136119006
EMGEAS.MI,IE00B3Z3FS74,UBS(Irl)FdSltnsplc MSCI Em Mkts SF U ETF USD Aacc,,Equity ETF,Ireland,2013-01-22,2023-11-03,10.778918548939084,190.2788290576581,4.358046365039256
JETS.MI,IE00BN76Y761,US Global Jets UCITS ETF Acc,Equity Sector Industrials,Equity ETF,Ireland,2021-06-30,2023-11-10,2.3627652292950034,157.0194090382387,0.19694168203711654
CYBO.MI,IE0005TF96I9,VanEck Bionic Engineering UCITS ETF USD A,Equity Sector Healthcare,Equity ETF,Ireland,2023-02-02,2023-11-09,0.7665982203969883,127.8375,0.0909501617899694
REUS.MI,IE0001J5A2T9,VanEck Circular Economy UCITS ETF USD A,Equity Global,Equity ETF,Ireland,2023-02-01,2023-11-08,0.7665982203969883,37.82946428571429,0.1136708170813793
DAPP.MI,IE00BMDKNW35,VanEck Crypto and Blckchn Innvtrs UCITS ETF USD A,Equity Sector Information Tech,Equity ETF,Ireland,2021-05-21,2023-11-10,2.4722792607802875,256.4435215946844,0.7952181789323763
DFNS.MI,IE000YYE6WK5,VanEck Defense UCITS ETF USD A,,Equity ETF,,2023-05-17,2023-11-10,0.48459958932238195,262.07203389830505,1.3184409915329527
HYEM.MI,IE00BF541080,VanEck Em Mkts High Yield Bond UCITS ETF USD A,Bond USD High Yield,Bond ETF,Ireland,2018-05-29,2023-11-10,5.451060917180014,150.42943244600704,4.942132245714634
CURGE.MI,IE000B9PQW54,VanEck Genomics & Hlthcare Innvtrs UCITS ETF USD A,Equity Sector Healthcare,Equity ETF,Ireland,2022-10-07,2023-11-02,1.0704996577686516,58.85102301790281,0.10055949363714285
GFA.MI,IE00BF540Z61,VanEck Global Fallen Angel High Yield Bond UCITS ETF,Bond Global High Yield LC,Bond ETF,Ireland,2018-05-28,2023-11-10,5.453798767967146,198.7605421686747,2.4082156028689963
GDIG.MI,IE00BDFBTQ78,VanEck Global Mining UCITS ETF,Equity Sector Materials,Equity ETF,Ireland,2018-05-24,2023-11-10,5.464750171115674,179.51415330661322,3.625046244876965
TRET.MI,NL0009690239,VanEck Global Real Estate UCITS ETF,Equity Sector Real Est Global,Equity ETF,Netherlands,2019-04-16,2023-11-10,4.569472963723477,212.4971539844218,2.324719738691653
GDX.MI,IE00BQQP9F84,VanEck Gold Miners UCITS ETF USD A,Equity Sector Gold&Prec Metals,Equity ETF,Ireland,2017-05-24,2023-11-10,6.464065708418891,234.06321473951715,15.522756414024803
HDRO.MI,IE00BMDH1538,VanEck Hydrogen Economy UCITS ETF USD A,Equity Sector Energy,Equity ETF,Ireland,2021-03-31,2023-09-28,2.4941820670773445,256.5971459934138,1.726246465018569
TCBT.MI,NL0009690247,VanEck iBoxx EUR Corporates UCITS ETF,Bond EUR Corporates,Bond ETF,Netherlands,2019-05-10,2023-11-01,4.479123887748118,38.84688264058679,1.3197009378274942
TAT.MI,NL0010273801,VanEck iBoxx EUR Sov Cp AAA-AA 1-5 UC ETF,,Bond ETF,,2019-04-24,2023-11-09,4.544832306639288,32.34442771084338,0.5951904821823333
TGBT.MI,NL0009690254,VanEck iBoxx EUR Sovereign Diversifi 1-10,Bond EMU Government,Bond ETF,Netherlands,2019-04-25,2023-11-01,4.520191649555099,12.610084797092671,0.14980907155207016
EMLC.MI,IE00BDS67326,VanEck J.P. Morgan EM Loc Curr Bd UCITS ETF USD A,Bond Emerging Mkts Global LC,Bond ETF,Ireland,2017-05-29,2023-11-09,6.447638603696099,121.75,1.4767015597927928
GDXJ.MI,IE00BQQP9G91,VanEck Junior Gold Miners UCITS ETF USD A,Equity Sector Gold&Prec Metals,Equity ETF,Ireland,2017-05-23,2023-11-10,6.466803559206023,239.2217400508044,10.755000086743678
GOAT.MI,IE00BL0BMZ89,VanEck Morningstar Gl Wide Moat UCITS ETF USD A,Equity Global,Equity ETF,Ireland,2020-09-15,2023-11-10,3.1512662559890487,247.83688097306688,1.1901902672933087
MOAT.MI,IE00BQQP9H09,VanEck Morningstar US Sustainable Wide Moat UCITS ETF,Equity US,Equity ETF,Ireland,2017-05-23,2023-11-10,6.466803559206023,231.799216765453,3.7892423006641205
TDIV.MI,NL0011683594,VanEck Ms Developed Markets Div Lead UCITS ETF,*Equity Global Income,Equity ETF,Netherlands,2019-04-23,2023-11-10,4.550308008213553,179.98781588447653,2.8175640872357746
CNEW.MI,IE0000H445G8,VanEck New China ESG UCITS ETF,Equity China,Equity ETF,Ireland,2021-10-04,2023-11-10,2.099931553730322,127.6232073011734,0.23561237272810448
OIH.MI,IE000NXF88S1,VanEck Oil Services UCITS ETF USD A,,Equity ETF,,2023-05-26,2023-11-02,0.4380561259411362,86.746875,0.4641166555046053
REMX.MI,IE0002PG6CA6,VanEck Rare Earth and Strategic Metals UCITS ETF,Equity Sector Materials,Equity ETF,Ireland,2021-10-04,2023-11-10,2.099931553730322,257.1512385919165,5.153509518967248
SMH.MI,IE00BMC38736,VanEck Semiconductor UCITS ETF USD A,Equity US,Equity ETF,Ireland,2020-12-03,2023-09-28,2.817248459958932,255.56851311953355,48.490565404941286
CAVE.MI,IE000FN81QD2,VanEck Smart Home Active UCITS ETF,Equity Global,Equity ETF,Ireland,2021-11-25,2023-09-04,1.7741273100616017,45.09259259259259,0.11180483218425
JEDII.MI,IE000YU9K6K2,VANECK SPACE INNOVATORS UCITS ETF,Equity Sector Industrials,Equity ETF,Ireland,2022-09-13,2023-11-10,1.158110882956879,166.65070921985816,0.1423385299368031
VEGII.MI,IE0005B8WVT6,VANECK SUST FUTURE OF FOOD UCITS ETF,,Equity ETF,Ireland,2022-09-08,2023-11-07,1.163586584531143,55.86176470588235,0.04845115147484615
TEET.MI,NL0010731816,VanEck Sustainable European Equal Weight UCITS ETF,Equity Europe,Equity ETF,Netherlands,2019-05-03,2023-11-01,4.498288843258043,22.00836883749239,2.0642064108656566
TSWE.MI,NL0010408704,VanEck Sustainable World Equal Weight ETF,Equity Global,Equity ETF,Netherlands,2019-04-17,2023-11-10,4.566735112936345,128.53821942446044,0.5409557559801039
NUCL.MI,IE000M7V94E1,VanEck Uranium and Nuclear Technlgs U ETF USD A,,Equity ETF,,2023-04-24,2023-11-10,0.5475701574264202,193.5825,0.38071983887317923
VDTM.MI,NL0009272764,VANECK VDTM EUR,Mixed Asset EUR Cons - EuroZone,Equity ETF,Netherlands,2022-09-09,2023-09-21,1.0321697467488022,65.88063660477454,0.5919083906102941
ESPO.MI,IE00BYWQWR46,VanEck Video Gaming and eSports UCITS ETF USD A,Equity Global,Equity ETF,Ireland,2019-09-10,2023-11-10,4.167008898015058,255.33902759526939,21.884377622549817
VNTM.MI,NL0009272772,VANECK VNTM EUR,Mixed Asset EUR Bal - Global,Equity ETF,Netherlands,2022-09-08,2023-09-28,1.054072553045859,88.22922077922078,0.9808375151494623
VTOF.MI,NL0009272780,VANECK VTOF EUR,Mixed Asset EUR Agg - Global,Equity ETF,Ireland,2022-09-07,2023-09-27,1.054072553045859,70.2038961038961,0.8819870738891893
V3EA.MI,IE000QUOSE01,Vanguard ESG Dev Europe All Cap UCITS ETF EUR Acc,Equity Europe,Equity ETF,Ireland,2022-08-23,2023-11-06,1.2046543463381245,71.38977272727273,0.03659509662643314
V3EL.MI,IE000NRGX9M3,Vanguard ESG Dev Europe All Cap UCITS ETF EUR Dist,Equity Europe,Equity ETF,Ireland,2022-08-25,2023-10-24,1.163586584531143,30.07941176470588,0.033301970074371426
V3PAA.MI,IE000GOJO2A3,Vanguard ESG DevAsiaPacific AC UCITS ETF Acc,Equity Asia Pacific,Equity ETF,Ireland,2022-10-20,2023-11-09,1.054072553045859,73.05,0.03715594104451948
V3PLA.MI,IE0008T6IUX0,Vanguard ESG DevAsiaPacific AC UCITS ETF Dis,Equity Asia Pacific,Equity ETF,Ireland,2022-11-07,2023-10-18,0.944558521560575,37.05434782608695,0.07247913508531428
V3MAA.MI,IE000KPJJWM6,Vanguard ESG Emg Markets All Cap UCITS ETF USD Acc,Equity Emerging Mkts Global,Equity ETF,Ireland,2022-10-20,2023-11-01,1.0321697467488022,36.815649867374006,0.044386019413552635
V3MLA.MI,IE0001VXZTV7,Vanguard ESG Emg Markets All Cap UCITS ETF USD Dis,Equity Emerging Mkts Global,Equity ETF,Ireland,2022-10-31,2023-10-31,0.999315537303217,28.01917808219178,0.05623625469480357
V3REV.MI,IE000QADMYA3,Vanguard ESG EUR Corporate Bond UCITS ETF EUR Acc,Bond EUR Corporates,Bond ETF,Ireland,2022-11-29,2023-11-10,0.947296372347707,232.2398843930636,0.1539884730942341
V3RFV.MI,IE000F37PGZ3,Vanguard ESG EUR Corporate Bond UCITS ETF EUR Dist,Bond EUR Corporates,Bond ETF,Ireland,2022-11-21,2023-11-08,0.9637234770704997,102.7265625,0.09791452158667424
V3AA.MI,IE00BNG8L278,Vanguard ESG Global All Cap UCITS ETF (USD) Acc,Equity Global,Equity ETF,Ireland,2021-04-13,2023-11-10,2.5763175906913074,249.5810308182784,0.1659217553344172
V3AL.MI,IE00BNG8L385,Vanguard ESG Global All Cap UCITS ETF (USD) Dist,Equity Global,Equity ETF,Ireland,2021-04-13,2023-11-07,2.568104038329911,148.74786780383795,0.049530287255689795
V3GF.MI,IE00BNDS1P30,Vanguard ESG Global Corp Bond UCITS ETF EUR Hgd A,Bond Global Corporates USD,Bond ETF,Ireland,2021-05-25,2023-11-10,2.461327857631759,171.85845383759732,0.7166243262098788
V3GE.MI,IE00BNDS1Q47,Vanguard ESG Global Corp Bond UCITS ETF EUR Hgd D,Bond Global Corporates USD,Bond ETF,Ireland,2021-05-25,2023-11-09,2.458590006844627,141.54454342984408,0.09864010466436782
V3NA.MI,IE000O58J820,Vanguard ESG N America All Cap UCITS ETF USD Acc,Equity US,Equity ETF,Ireland,2022-08-23,2023-11-06,1.2046543463381245,55.617613636363636,0.10627940493296645
V3NL.MI,IE000L2ZNB07,Vanguard ESG N America All Cap UCITS ETF USD Dist,Equity US,Equity ETF,Ireland,2022-08-25,2023-11-07,1.2019164955509924,18.304100227790432,0.01953331359423864
V3SE.MI,IE000EKJRSZ3,Vanguard ESG USD Corporate Bond UCITS ETF EUR Hgd Acc,Bond USD Corporates,Bond ETF,Ireland,2022-11-28,2023-10-19,0.8898015058179329,43.83,0.17090697367192306
V3SDV.MI,IE000JQV8511,Vanguard ESG USD Corporate Bond UCITS ETF USD Acc,Bond USD Corporates,Bond ETF,Ireland,2022-11-29,2023-10-16,0.8788501026694046,29.584112149532707,0.11047978231381733
V3SUV.MI,IE000RO1O3N4,Vanguard ESG USD Corporate Bond UCITS ETF USD Dist,Bond USD Corporates,Bond ETF,Ireland,2022-11-21,2023-10-16,0.9007529089664613,42.18693009118541,0.12236588521023026
VECA.MI,IE00BGYWT403,Vanguard EUR Corporate Bond UCITS ETF EUR Acc,,Bond ETF,Ireland,2020-01-14,2023-11-10,3.8220396988364134,237.8311246418338,8.881780144006658
VECP.MI,IE00BZ163G84,Vanguard EUR Corporate Bond UCITS ETF EUR Dis,Bond EUR Corporates,Bond ETF,Ireland,2019-01-18,2023-11-10,4.810403832991102,252.99331246442802,11.9348967465438
VGEA.MI,IE00BH04GL39,Vanguard EUR Eurozone Gvt Bd UCITS ETF EUR Acc,,Bond ETF,Ireland,2020-01-14,2023-11-10,3.8220396988364134,235.21472063037248,6.86709860024703
VETY.MI,IE00BZ163H91,Vanguard EUR Eurozone Gvt Bd UCITS ETF EUR Dis,Bond EMU Government,Bond ETF,Ireland,2019-01-18,2023-11-10,4.810403832991102,251.5381331815595,13.641402949167459
VUKE.MI,IE00B810Q511,Vanguard FTSE 100 UCITS ETF GBP Dis,Equity UK,Equity ETF,Ireland,2019-01-21,2023-09-28,4.684462696783025,225.85300993571013,12.090959598091233
VMIG.MI,IE00BFMXVQ44,Vanguard FTSE 250 UCITS ETF GBP Acc,,Equity ETF,,2023-08-02,2023-08-28,0.07118412046543464,28.096153846153843,2.0516260107375
VWCE.MI,IE00BK5BQT80,Vanguard FTSE All-World UCITS ETF USD Acc,Equity Global,Equity ETF,Ireland,2020-01-14,2023-09-28,3.704312114989733,255.3780487804878,60.78172922234051
VWRL.MI,IE00B3RBWM25,Vanguard FTSE All-World UCITS ETF USD Dis,Equity Global,Equity ETF,Ireland,2019-01-18,2023-11-10,4.810403832991102,254.44849174729654,58.007319237409185
VWCG.MI,IE00BK5BQX27,Vanguard FTSE Developed Europe UCITS ETF EUR A,Equity Europe,Equity ETF,Ireland,2020-01-31,2023-11-10,3.7754962354551678,221.95757795503988,3.941167943358323
VEUR.MI,IE00B945VV12,Vanguard FTSE Developed Europe UCITS ETF EUR D,Equity Europe,Equity ETF,Ireland,2019-01-21,2023-11-10,4.802190280629706,248.22006841505132,3.443855895917254
